{
  "media_type": "movie",
  "title": "Cure",
  "year": 1997,
  "tmdb_id": 36095,
  "tvdb_id": 9398,
  "imdb_id": "tt0123948",
  "poster_url": "https://image.tmdb.org/t/p/original/myHbmoeeu8ClSn7MPM8Lcv2sj2d.jpg",
  "background_url": "https://image.tmdb.org/t/p/original/74ws1jjgawIl7Kwi6FCH8E4SjDd.jpg",
  "youtube_id_overturedb": "mznVm2_UxGI",
  "youtube_id_themerrdb": null
}
