{
  "media_type": "movie",
  "title": "Adam's Rib",
  "year": 1949,
  "tmdb_id": 25431,
  "tvdb_id": 12308,
  "imdb_id": "tt0041090",
  "poster_url": "https://image.tmdb.org/t/p/original/kHGf5oGTSHlXy44EK5FELYuMJBm.jpg",
  "background_url": "https://image.tmdb.org/t/p/original/kCGqiFppPawKgFFXE5QXBUcj80r.jpg",
  "youtube_id_overturedb": null,
  "youtube_id_themerrdb": null
}
