{
  "media_type": "movie",
  "title": "No Half Measures: Creating the Final Season of Breaking Bad",
  "year": 2013,
  "tmdb_id": 239459,
  "tvdb_id": 18249,
  "imdb_id": "tt3088036",
  "poster_url": "https://image.tmdb.org/t/p/original/ApitDfnYDwFNOPfyVuhW5ElWzhe.jpg",
  "background_url": "https://image.tmdb.org/t/p/original/mHWqRYfri69s8FXtWvvGmF96f0v.jpg",
  "youtube_id_overturedb": null,
  "youtube_id_themerrdb": null
}
