{
  "media_type": "show",
  "title": "Chillin' in My 30s After Getting Fired From the Demon King's Army",
  "year": 2023,
  "tmdb_id": 206324,
  "tvdb_id": null,
  "imdb_id": null,
  "poster_url": null,
  "background_url": null,
  "youtube_id_overturedb": null,
  "youtube_id_themerrdb": "tY2pa02AN8Y",
  "seasons": []
}
