{
  "media_type": "movie",
  "title": "Bicycle Thieves",
  "year": 1948,
  "tmdb_id": 5156,
  "tvdb_id": 4381,
  "imdb_id": "tt0040522",
  "poster_url": "https://image.tmdb.org/t/p/original/jDJi2uSJsBNjeEsuqMiDtyKtYFy.jpg",
  "background_url": "https://image.tmdb.org/t/p/original/nd6ItWuWGmTKhHXuxVC8kp86CmQ.jpg",
  "youtube_id_overturedb": null,
  "youtube_id_themerrdb": null
}
