{
  "media_type": "movie",
  "title": "Billy Liar",
  "year": 1963,
  "tmdb_id": 26535,
  "tvdb_id": 13675,
  "imdb_id": "tt0056868",
  "poster_url": "https://image.tmdb.org/t/p/original/9XHu8q7ns1JFirfueDSXGSq16KK.jpg",
  "background_url": "https://image.tmdb.org/t/p/original/cWZ7RYJYA3Hdi9TsI35j6YZKcrj.jpg",
  "youtube_id_overturedb": null,
  "youtube_id_themerrdb": null
}
