{
  "media_type": "movie",
  "title": "Close",
  "year": 2022,
  "tmdb_id": 901563,
  "tvdb_id": 336577,
  "imdb_id": "tt9660502",
  "poster_url": "https://image.tmdb.org/t/p/original/dlMNnWs7Mz8Nk5AC447Ew1tD5pn.jpg",
  "background_url": "https://image.tmdb.org/t/p/original/5bxNLYAYAF7u1nAo2E5rQYSXSFV.jpg",
  "youtube_id_overturedb": null,
  "youtube_id_themerrdb": null
}
