{
  "media_type": "movie",
  "title": "Chimes at Midnight",
  "year": 1965,
  "tmdb_id": 986,
  "tvdb_id": 13740,
  "imdb_id": "tt0059012",
  "poster_url": "https://image.tmdb.org/t/p/original/37XWyaiUNFCvt2iztZuVr37bSnH.jpg",
  "background_url": "https://image.tmdb.org/t/p/original/690AMZjDXTCtIJmbErihfOmSJz7.jpg",
  "youtube_id_overturedb": null,
  "youtube_id_themerrdb": null
}
