{
  "media_type": "movie",
  "title": "A Taste of Honey",
  "year": 1961,
  "tmdb_id": 25062,
  "tvdb_id": 42365,
  "imdb_id": "tt0055506",
  "poster_url": "https://image.tmdb.org/t/p/original/gMEnU4EMo91KmjkJIN8frLSWosT.jpg",
  "background_url": "https://image.tmdb.org/t/p/original/5aXFIzQHMHM7uOJEQD0fxV8dRtr.jpg",
  "youtube_id_overturedb": null,
  "youtube_id_themerrdb": null
}
