{
  "media_type": "movie",
  "title": "Funny Girl",
  "year": 1968,
  "tmdb_id": 16085,
  "tvdb_id": null,
  "imdb_id": "tt0062994",
  "poster_url": "https://image.tmdb.org/t/p/original/xIGTvoohmFOfKgbysFEywqboiWd.jpg",
  "background_url": null,
  "youtube_id_overturedb": null,
  "youtube_id_themerrdb": null
}
