{
  "media_type": "movie",
  "title": "Ali: Fear Eats the Soul",
  "year": 1974,
  "tmdb_id": 216,
  "tvdb_id": 9004,
  "imdb_id": "tt0071141",
  "poster_url": "https://theposterdb.com/api/assets/92913",
  "background_url": "https://image.tmdb.org/t/p/original/xIn1ozKRLIXw9uMFD5QBUxVMi2B.jpg",
  "youtube_id_overturedb": null,
  "youtube_id_themerrdb": null
}
