{
  "media_type": "movie",
  "title": "Better Man",
  "year": 2024,
  "tmdb_id": 799766,
  "tvdb_id": 360560,
  "imdb_id": "tt14260836",
  "poster_url": "https://image.tmdb.org/t/p/original/fbGCmMp0HlYnAPv28GOENPShezM.jpg",
  "background_url": "https://image.tmdb.org/t/p/original/6NQw3D6bs3Pfxl7CV1t7pIHgaOF.jpg",
  "youtube_id_overturedb": null,
  "youtube_id_themerrdb": null
}
