{
  "media_type": "movie",
  "title": "Nightmare Alley",
  "year": 1947,
  "tmdb_id": 19169,
  "tvdb_id": 26001,
  "imdb_id": "tt0039661",
  "poster_url": "https://image.tmdb.org/t/p/original/7fZPspiEnlo8Ht2AYMQZnQfYl89.jpg",
  "background_url": "https://image.tmdb.org/t/p/original/awftndYi9pY9DjegLXkGBx9Rzyb.jpg",
  "youtube_id_overturedb": null,
  "youtube_id_themerrdb": null
}
