{
  "media_type": "movie",
  "title": "Alien: Romulus",
  "year": 2024,
  "tmdb_id": 945961,
  "tvdb_id": 349288,
  "imdb_id": "tt18412256",
  "poster_url": "https://image.tmdb.org/t/p/original/b33nnKl1GSFbao4l3fZDDqsMx0F.jpg",
  "background_url": "https://image.tmdb.org/t/p/original/wP2CSAMIb2TlNUlt96SVmIMMHbt.jpg",
  "youtube_id_overturedb": null,
  "youtube_id_themerrdb": "taZTwk0Xq9s"
}
