{
  "media_type": "movie",
  "title": "Casualties of War",
  "year": 1989,
  "tmdb_id": 10142,
  "tvdb_id": 7304,
  "imdb_id": "tt0097027",
  "poster_url": "https://image.tmdb.org/t/p/original/8bQGwn1HYoVCmP4nMB4ScQg7aKj.jpg",
  "background_url": "https://image.tmdb.org/t/p/original/8bUUOgBO6mEO4p3OAxaCcajApVk.jpg",
  "youtube_id_overturedb": null,
  "youtube_id_themerrdb": null
}
