{
  "media_type": "movie",
  "title": "Dune",
  "year": 2021,
  "tmdb_id": 438631,
  "tvdb_id": 6187,
  "imdb_id": "tt1160419",
  "poster_url": "https://theposterdb.com/api/assets/539522",
  "background_url": "https://image.tmdb.org/t/p/original/5737nHYFVoyZBuslK6OkwzsOVo3.jpg",
  "youtube_id_overturedb": null,
  "youtube_id_themerrdb": "EAlssqDSwPo"
}
