{
  "media_type": "movie",
  "title": "Talking Funny",
  "year": 2011,
  "tmdb_id": 62425,
  "tvdb_id": 33760,
  "imdb_id": "tt1909348",
  "poster_url": "https://image.tmdb.org/t/p/original/3qLox8ugQzi1CilelXLoJuJDKoc.jpg",
  "background_url": "https://image.tmdb.org/t/p/original/3T3BLfbuIGfpYKebxOe7bqVULU1.jpg",
  "youtube_id_overturedb": null,
  "youtube_id_themerrdb": null
}
