{
  "media_type": "movie",
  "title": "Copying Beethoven",
  "year": 2006,
  "tmdb_id": 1590,
  "tvdb_id": 13416,
  "imdb_id": "tt0424908",
  "poster_url": "https://image.tmdb.org/t/p/original/xplAbPXhZF9B3H4OnhjQsEKUESe.jpg",
  "background_url": "https://artworks.thetvdb.com/banners/movies/13416/backgrounds/13416.jpg",
  "youtube_id_overturedb": null,
  "youtube_id_themerrdb": null
}
