{
  "media_type": "movie",
  "title": "Judgment at Nuremberg",
  "year": 1961,
  "tmdb_id": 821,
  "tvdb_id": 2726,
  "imdb_id": "tt0055031",
  "poster_url": "https://image.tmdb.org/t/p/original/oZ3j25pMIr3Gn6CAq7rq08Co04v.jpg",
  "background_url": "https://image.tmdb.org/t/p/original/b9w0tocXII7z69YzXU3WYBJM6fQ.jpg",
  "youtube_id_overturedb": null,
  "youtube_id_themerrdb": null
}
