{
  "media_type": "movie",
  "title": "Brothers",
  "year": 2004,
  "tmdb_id": 3875,
  "tvdb_id": 15280,
  "imdb_id": "tt0386342",
  "poster_url": "https://image.tmdb.org/t/p/original/faViDuoxyQ3qJsCbLclqBp4oK4y.jpg",
  "background_url": "https://image.tmdb.org/t/p/original/7Vq8FDnmkw75QRipA5zLkTsTgdU.jpg",
  "youtube_id_overturedb": null,
  "youtube_id_themerrdb": null
}
