{
  "media_type": "movie",
  "title": "Tale of Tales",
  "year": 1979,
  "tmdb_id": 36079,
  "tvdb_id": 31599,
  "imdb_id": "tt0079986",
  "poster_url": "https://image.tmdb.org/t/p/original/7gWBy9z4JrkDPSfG5VbjWbbgvxk.jpg",
  "background_url": null,
  "youtube_id_overturedb": null,
  "youtube_id_themerrdb": null
}
