{
  "media_type": "movie",
  "title": "Guess Who's Coming to Dinner",
  "year": 1967,
  "tmdb_id": 1879,
  "tvdb_id": 5468,
  "imdb_id": "tt0061735",
  "poster_url": "https://image.tmdb.org/t/p/original/pgQe94fSlT5xFiNKziQg3jK82jl.jpg",
  "background_url": "https://image.tmdb.org/t/p/original/8TKLGDXhrCc0RD1JWgndnMKt7y8.jpg",
  "youtube_id_overturedb": null,
  "youtube_id_themerrdb": "UdPycJ8L0HA"
}
