{
  "media_type": "movie",
  "title": "Best of Enemies",
  "year": 2015,
  "tmdb_id": 319067,
  "tvdb_id": 10240,
  "imdb_id": "tt3518012",
  "poster_url": "https://image.tmdb.org/t/p/original/fZoEfqzhuGEikvnVLLn5aJPhrm3.jpg",
  "background_url": "https://image.tmdb.org/t/p/original/iaUoSsfOkzoaV8QBUlaDmW0PkBP.jpg",
  "youtube_id_overturedb": null,
  "youtube_id_themerrdb": null
}
