{
  "media_type": "movie",
  "title": "Breakfast at Tiffany's",
  "year": 1961,
  "tmdb_id": 164,
  "tvdb_id": 1816,
  "imdb_id": "tt0054698",
  "poster_url": "https://image.tmdb.org/t/p/original/cd3xayReVIIHMf4fZDSH45QiTvh.jpg",
  "background_url": "https://image.tmdb.org/t/p/original/pvBJuLAKyVPVRzCfLNufYiarO9e.jpg",
  "youtube_id_overturedb": null,
  "youtube_id_themerrdb": null
}
